iteration	change	metric	result	decision	notes
70	harden RQ1 execution provenance and GPU isolation evidence	schema-2 scientific execution gate	27 focused and 102 sampler/accounting/throughput compatibility tests passed; Ruff, format, compile, and diff checks clean	keep	path-independent scientific cell identity, exact full-config and split/init/source/asset closure, strict launcher completion and draw/accounting invariants, nanosecond-consistent chronology, and frozen RTX 5090 raw sample-chain monitoring reject reproduced rehash attacks; local claims remain advisory, external WORM authority is absent, and scientific launch readiness stays false
71	bind matched RQ1 cells to the effective scientific environment	cross-arm matching integrity gate	28 focused and 103 sampler/accounting/throughput compatibility tests passed; Ruff, format, compile, and diff checks clean	keep	exact allowlisted child variables now enter the matched-training digest through a path-normalized contract; per-run repo/storage/output/tmp names are tokenized, OMP 1 versus 64 produces different matched hashes and cells, and copied-lock/run-id/storage-root invariance remains intact
72	freeze the headline Lite-S throughput sweep	5090 workload-selection gate	1,996-motion dataset verified; four Hydra cells compose; immutable CPU-built plan digest 378362b5; consolidated integrity suite 540 passed	keep	the plan binds 197 Python files, 118 Hydra sources, exact Lite-S initialization and all headline D_curriculum identities; N_env 128/256/512/1024 remain unlaunched because a foreign process leaves 23,246 MiB free below the frozen 28,672 MiB gate
73	format the full LACE surface and rebuild the frozen sweep	repository quality and source-closure gate	Ruff passed; Black 87 files clean; 540 tests passed; replacement plan digest 9980b241	keep	removed one unused import, formatted 12 LACE files, reran the consolidated suite, and wrote immutable v2 plan file SHA 4f6bf6e1; v1 remains untouched but is explicitly superseded before any GPU cell ran
